{
  "$schema": "../../../shared/schemas/anim_clip.schema.json",
  "version": "1.0.0",
  "id": "e0e41abc-0c69-4d3f-9cf4-eda9cdf44684",
  "name": "HitReact",
  "skeletonId": "11111111-aaaa-4b3c-8d2e-000000000001",
  "durationSeconds": 0.55,
  "fps": 30.0,
  "loopable": false,
  "rootMotion": false,
  "channels": [
    {
      "boneIndex": 0,
      "boneName": "root",
      "keyframes": [
        {
          "time": 0.0,
          "translation": [
            0,
            0,
            0
          ],
          "rotation": [
            0.0,
            0.0,
            0.0,
            1.0
          ],
          "scale": [
            1.0,
            1.0,
            1.0
          ]
        },
        {
          "time": 0.14,
          "translation": [
            0,
            0,
            -0.1
          ],
          "rotation": [
            0.0,
            0.0,
            0.0,
            1.0
          ],
          "scale": [
            1.0,
            1.0,
            1.0
          ]
        },
        {
          "time": 0.55,
          "translation": [
            0,
            0,
            0
          ],
          "rotation": [
            0.0,
            0.0,
            0.0,
            1.0
          ],
          "scale": [
            1.0,
            1.0,
            1.0
          ]
        }
      ]
    },
    {
      "boneIndex": 3,
      "boneName": "spine_02",
      "keyframes": [
        {
          "time": 0.0,
          "translation": [
            0,
            0.12,
            0
          ],
          "rotation": [
            0.0,
            0.0,
            0.0,
            1.0
          ],
          "scale": [
            1.0,
            1.0,
            1.0
          ]
        },
        {
          "time": 0.14,
          "translation": [
            0,
            0.08,
            -0.05
          ],
          "rotation": [
            0.2,
            0,
            0,
            0.98
          ],
          "scale": [
            1.0,
            1.0,
            1.0
          ]
        },
        {
          "time": 0.55,
          "translation": [
            0,
            0.12,
            0
          ],
          "rotation": [
            0.0,
            0.0,
            0.0,
            1.0
          ],
          "scale": [
            1.0,
            1.0,
            1.0
          ]
        }
      ]
    },
    {
      "boneIndex": 6,
      "boneName": "head",
      "keyframes": [
        {
          "time": 0.0,
          "translation": [
            0,
            0.12,
            0
          ],
          "rotation": [
            0.0,
            0.0,
            0.0,
            1.0
          ],
          "scale": [
            1.0,
            1.0,
            1.0
          ]
        },
        {
          "time": 0.12,
          "translation": [
            0,
            0.09,
            -0.03
          ],
          "rotation": [
            0.18,
            0,
            0,
            0.984
          ],
          "scale": [
            1.0,
            1.0,
            1.0
          ]
        },
        {
          "time": 0.55,
          "translation": [
            0,
            0.12,
            0
          ],
          "rotation": [
            0.0,
            0.0,
            0.0,
            1.0
          ],
          "scale": [
            1.0,
            1.0,
            1.0
          ]
        }
      ]
    }
  ]
}