{
  "$schema": "../../../shared/schemas/anim_clip.schema.json",
  "version": "1.0.0",
  "id": "7913e7d3-4ac6-4b7d-8c66-95dbaf3c2406",
  "name": "Block",
  "skeletonId": "11111111-aaaa-4b3c-8d2e-000000000001",
  "durationSeconds": 0.8,
  "fps": 30.0,
  "loopable": true,
  "rootMotion": false,
  "channels": [
    {
      "boneIndex": 8,
      "boneName": "L_upper_arm",
      "keyframes": [
        {
          "time": 0.0,
          "translation": [
            0.22,
            0,
            0
          ],
          "rotation": [
            0.0,
            0.0,
            0.0,
            1.0
          ],
          "scale": [
            1.0,
            1.0,
            1.0
          ]
        },
        {
          "time": 0.2,
          "translation": [
            0.22,
            0,
            0
          ],
          "rotation": [
            0.4,
            0,
            0.25,
            0.88
          ],
          "scale": [
            1.0,
            1.0,
            1.0
          ]
        },
        {
          "time": 0.8,
          "translation": [
            0.22,
            0,
            0
          ],
          "rotation": [
            0.4,
            0,
            0.25,
            0.88
          ],
          "scale": [
            1.0,
            1.0,
            1.0
          ]
        }
      ]
    },
    {
      "boneIndex": 12,
      "boneName": "R_upper_arm",
      "keyframes": [
        {
          "time": 0.0,
          "translation": [
            -0.22,
            0,
            0
          ],
          "rotation": [
            0.0,
            0.0,
            0.0,
            1.0
          ],
          "scale": [
            1.0,
            1.0,
            1.0
          ]
        },
        {
          "time": 0.2,
          "translation": [
            -0.22,
            0,
            0
          ],
          "rotation": [
            0.4,
            0,
            -0.25,
            0.88
          ],
          "scale": [
            1.0,
            1.0,
            1.0
          ]
        },
        {
          "time": 0.8,
          "translation": [
            -0.22,
            0,
            0
          ],
          "rotation": [
            0.4,
            0,
            -0.25,
            0.88
          ],
          "scale": [
            1.0,
            1.0,
            1.0
          ]
        }
      ]
    },
    {
      "boneIndex": 3,
      "boneName": "spine_02",
      "keyframes": [
        {
          "time": 0.0,
          "translation": [
            0,
            0.12,
            0
          ],
          "rotation": [
            0.0,
            0.0,
            0.0,
            1.0
          ],
          "scale": [
            1.0,
            1.0,
            1.0
          ]
        },
        {
          "time": 0.2,
          "translation": [
            0,
            0.11,
            -0.03
          ],
          "rotation": [
            0.0,
            0.0,
            0.0,
            1.0
          ],
          "scale": [
            1.0,
            1.0,
            1.0
          ]
        },
        {
          "time": 0.8,
          "translation": [
            0,
            0.11,
            -0.03
          ],
          "rotation": [
            0.0,
            0.0,
            0.0,
            1.0
          ],
          "scale": [
            1.0,
            1.0,
            1.0
          ]
        }
      ]
    }
  ]
}