{
  "$schema": "../../../shared/schemas/anim_clip.schema.json",
  "version": "1.0.0",
  "id": "55555555-eeee-4f60-c178-000000000005",
  "name": "AttackSlash",
  "skeletonId": "11111111-aaaa-4b3c-8d2e-000000000001",
  "durationSeconds": 0.8,
  "fps": 30.0,
  "loopable": false,
  "rootMotion": false,
  "channels": [
    {
      "boneIndex": 0,
      "boneName": "root",
      "keyframes": [
        {
          "time": 0.0,
          "translation": [
            0.0,
            0.0,
            0.0
          ],
          "rotation": [
            0.0,
            0.0,
            0.0,
            1.0
          ],
          "scale": [
            1.0,
            1.0,
            1.0
          ]
        },
        {
          "time": 0.3,
          "translation": [
            0.0,
            0.0,
            -0.15
          ],
          "rotation": [
            0.0,
            0.0,
            0.0,
            1.0
          ],
          "scale": [
            1.0,
            1.0,
            1.0
          ]
        },
        {
          "time": 0.6,
          "translation": [
            0.0,
            0.0,
            -0.2
          ],
          "rotation": [
            0.0,
            0.0,
            0.0,
            1.0
          ],
          "scale": [
            1.0,
            1.0,
            1.0
          ]
        },
        {
          "time": 0.8,
          "translation": [
            0.0,
            0.0,
            -0.15
          ],
          "rotation": [
            0.0,
            0.0,
            0.0,
            1.0
          ],
          "scale": [
            1.0,
            1.0,
            1.0
          ]
        }
      ]
    },
    {
      "boneIndex": 3,
      "boneName": "spine_02",
      "keyframes": [
        {
          "time": 0.0,
          "translation": [
            0.0,
            0.12,
            0.0
          ],
          "rotation": [
            0.0,
            -0.1,
            0.0,
            0.995
          ],
          "scale": [
            1.0,
            1.0,
            1.0
          ]
        },
        {
          "time": 0.25,
          "translation": [
            0.0,
            0.12,
            0.0
          ],
          "rotation": [
            0.0,
            -0.15,
            0.0,
            0.989
          ],
          "scale": [
            1.0,
            1.0,
            1.0
          ]
        },
        {
          "time": 0.45,
          "translation": [
            0.0,
            0.12,
            0.0
          ],
          "rotation": [
            0.0,
            0.2,
            0.0,
            0.98
          ],
          "scale": [
            1.0,
            1.0,
            1.0
          ]
        },
        {
          "time": 0.65,
          "translation": [
            0.0,
            0.12,
            0.0
          ],
          "rotation": [
            0.0,
            0.15,
            0.0,
            0.989
          ],
          "scale": [
            1.0,
            1.0,
            1.0
          ]
        },
        {
          "time": 0.8,
          "translation": [
            0.0,
            0.12,
            0.0
          ],
          "rotation": [
            0.0,
            0.0,
            0.0,
            1.0
          ],
          "scale": [
            1.0,
            1.0,
            1.0
          ]
        }
      ]
    },
    {
      "boneIndex": 12,
      "boneName": "R_upper_arm",
      "keyframes": [
        {
          "time": 0.0,
          "translation": [
            -0.22,
            0.0,
            0.0
          ],
          "rotation": [
            -0.5,
            0.0,
            0.0,
            0.866
          ],
          "scale": [
            1.0,
            1.0,
            1.0
          ]
        },
        {
          "time": 0.2,
          "translation": [
            -0.22,
            0.0,
            0.0
          ],
          "rotation": [
            -0.6,
            0.0,
            -0.1,
            0.794
          ],
          "scale": [
            1.0,
            1.0,
            1.0
          ]
        },
        {
          "time": 0.4,
          "translation": [
            -0.22,
            0.0,
            0.0
          ],
          "rotation": [
            0.5,
            0.0,
            0.1,
            0.861
          ],
          "scale": [
            1.0,
            1.0,
            1.0
          ]
        },
        {
          "time": 0.55,
          "translation": [
            -0.22,
            0.0,
            0.0
          ],
          "rotation": [
            0.6,
            0.0,
            0.0,
            0.8
          ],
          "scale": [
            1.0,
            1.0,
            1.0
          ]
        },
        {
          "time": 0.8,
          "translation": [
            -0.22,
            0.0,
            0.0
          ],
          "rotation": [
            0.1,
            0.0,
            0.0,
            0.995
          ],
          "scale": [
            1.0,
            1.0,
            1.0
          ]
        }
      ]
    },
    {
      "boneIndex": 8,
      "boneName": "L_upper_arm",
      "keyframes": [
        {
          "time": 0.0,
          "translation": [
            0.22,
            0.0,
            0.0
          ],
          "rotation": [
            0.2,
            0.0,
            0.1,
            0.973
          ],
          "scale": [
            1.0,
            1.0,
            1.0
          ]
        },
        {
          "time": 0.4,
          "translation": [
            0.22,
            0.0,
            0.0
          ],
          "rotation": [
            0.25,
            0.0,
            0.15,
            0.955
          ],
          "scale": [
            1.0,
            1.0,
            1.0
          ]
        },
        {
          "time": 0.8,
          "translation": [
            0.22,
            0.0,
            0.0
          ],
          "rotation": [
            0.1,
            0.0,
            0.05,
            0.993
          ],
          "scale": [
            1.0,
            1.0,
            1.0
          ]
        }
      ]
    }
  ],
  "events": [
    {
      "time": 0.4,
      "name": "hit_frame",
      "payload": {
        "bone": "R_hand",
        "damage": 1.0
      }
    },
    {
      "time": 0.15,
      "name": "sfx_sword_swing",
      "payload": {}
    }
  ]
}