{
  "$schema": "../../../shared/schemas/anim_clip.schema.json",
  "version": "1.0.0",
  "id": "49faac34-f484-47d8-a9ab-b198b8fbdc9f",
  "name": "GoblinHit",
  "skeletonId": "b5bb58f8-8e51-475a-9585-41fd02104e5b",
  "durationSeconds": 0.42,
  "fps": 30.0,
  "loopable": false,
  "rootMotion": false,
  "channels": [
    {
      "boneIndex": 0,
      "boneName": "root",
      "keyframes": [
        {
          "time": 0.0,
          "translation": [
            0,
            0,
            0
          ],
          "rotation": [
            0.0,
            0.0,
            0.0,
            1.0
          ],
          "scale": [
            1.0,
            1.0,
            1.0
          ]
        },
        {
          "time": 0.12,
          "translation": [
            0,
            0,
            -0.08
          ],
          "rotation": [
            0.0,
            0.0,
            0.0,
            1.0
          ],
          "scale": [
            1.0,
            1.0,
            1.0
          ]
        },
        {
          "time": 0.42,
          "translation": [
            0,
            0,
            0
          ],
          "rotation": [
            0.0,
            0.0,
            0.0,
            1.0
          ],
          "scale": [
            1.0,
            1.0,
            1.0
          ]
        }
      ]
    },
    {
      "boneIndex": 2,
      "boneName": "spine",
      "keyframes": [
        {
          "time": 0.0,
          "translation": [
            0,
            0.18,
            0
          ],
          "rotation": [
            0.0,
            0.0,
            0.0,
            1.0
          ],
          "scale": [
            1.0,
            1.0,
            1.0
          ]
        },
        {
          "time": 0.12,
          "translation": [
            0,
            0.12,
            -0.03
          ],
          "rotation": [
            0.28,
            0,
            0,
            0.96
          ],
          "scale": [
            1.0,
            1.0,
            1.0
          ]
        },
        {
          "time": 0.42,
          "translation": [
            0,
            0.18,
            0
          ],
          "rotation": [
            0.0,
            0.0,
            0.0,
            1.0
          ],
          "scale": [
            1.0,
            1.0,
            1.0
          ]
        }
      ]
    }
  ]
}