{
  "$schema": "../../../shared/schemas/anim_clip.schema.json",
  "version": "1.0.0",
  "id": "ebdd908e-71c6-4b99-add1-a38d782f43cc",
  "name": "MagicCast",
  "skeletonId": "11111111-aaaa-4b3c-8d2e-000000000001",
  "durationSeconds": 1.1,
  "fps": 30.0,
  "loopable": false,
  "rootMotion": false,
  "channels": [
    {
      "boneIndex": 0,
      "boneName": "root",
      "keyframes": [
        {
          "time": 0.0,
          "translation": [
            0,
            0,
            0
          ],
          "rotation": [
            0.0,
            0.0,
            0.0,
            1.0
          ],
          "scale": [
            1.0,
            1.0,
            1.0
          ]
        },
        {
          "time": 0.55,
          "translation": [
            0,
            0.03,
            0
          ],
          "rotation": [
            0.0,
            0.0,
            0.0,
            1.0
          ],
          "scale": [
            1.0,
            1.0,
            1.0
          ]
        },
        {
          "time": 1.1,
          "translation": [
            0,
            0,
            0
          ],
          "rotation": [
            0.0,
            0.0,
            0.0,
            1.0
          ],
          "scale": [
            1.0,
            1.0,
            1.0
          ]
        }
      ]
    },
    {
      "boneIndex": 3,
      "boneName": "spine_02",
      "keyframes": [
        {
          "time": 0.0,
          "translation": [
            0,
            0.12,
            0
          ],
          "rotation": [
            0.0,
            0.0,
            0.0,
            1.0
          ],
          "scale": [
            1.0,
            1.0,
            1.0
          ]
        },
        {
          "time": 0.45,
          "translation": [
            0,
            0.14,
            0
          ],
          "rotation": [
            0.08,
            0,
            0,
            0.997
          ],
          "scale": [
            1.0,
            1.0,
            1.0
          ]
        },
        {
          "time": 1.1,
          "translation": [
            0,
            0.12,
            0
          ],
          "rotation": [
            0.0,
            0.0,
            0.0,
            1.0
          ],
          "scale": [
            1.0,
            1.0,
            1.0
          ]
        }
      ]
    },
    {
      "boneIndex": 8,
      "boneName": "L_upper_arm",
      "keyframes": [
        {
          "time": 0.0,
          "translation": [
            0.22,
            0,
            0
          ],
          "rotation": [
            0.0,
            0.0,
            0.0,
            1.0
          ],
          "scale": [
            1.0,
            1.0,
            1.0
          ]
        },
        {
          "time": 0.5,
          "translation": [
            0.22,
            0,
            0
          ],
          "rotation": [
            0.55,
            0,
            0.12,
            0.82
          ],
          "scale": [
            1.0,
            1.0,
            1.0
          ]
        },
        {
          "time": 1.1,
          "translation": [
            0.22,
            0,
            0
          ],
          "rotation": [
            0.0,
            0.0,
            0.0,
            1.0
          ],
          "scale": [
            1.0,
            1.0,
            1.0
          ]
        }
      ]
    },
    {
      "boneIndex": 12,
      "boneName": "R_upper_arm",
      "keyframes": [
        {
          "time": 0.0,
          "translation": [
            -0.22,
            0,
            0
          ],
          "rotation": [
            0.0,
            0.0,
            0.0,
            1.0
          ],
          "scale": [
            1.0,
            1.0,
            1.0
          ]
        },
        {
          "time": 0.5,
          "translation": [
            -0.22,
            0,
            0
          ],
          "rotation": [
            0.55,
            0,
            -0.12,
            0.82
          ],
          "scale": [
            1.0,
            1.0,
            1.0
          ]
        },
        {
          "time": 1.1,
          "translation": [
            -0.22,
            0,
            0
          ],
          "rotation": [
            0.0,
            0.0,
            0.0,
            1.0
          ],
          "scale": [
            1.0,
            1.0,
            1.0
          ]
        }
      ]
    },
    {
      "boneIndex": 6,
      "boneName": "head",
      "keyframes": [
        {
          "time": 0.0,
          "translation": [
            0,
            0.12,
            0
          ],
          "rotation": [
            0.0,
            0.0,
            0.0,
            1.0
          ],
          "scale": [
            1.0,
            1.0,
            1.0
          ]
        },
        {
          "time": 0.5,
          "translation": [
            0,
            0.12,
            0
          ],
          "rotation": [
            0,
            0.06,
            0,
            0.998
          ],
          "scale": [
            1.0,
            1.0,
            1.0
          ]
        },
        {
          "time": 1.1,
          "translation": [
            0,
            0.12,
            0
          ],
          "rotation": [
            0.0,
            0.0,
            0.0,
            1.0
          ],
          "scale": [
            1.0,
            1.0,
            1.0
          ]
        }
      ]
    }
  ],
  "events": [
    {
      "time": 0.52,
      "name": "cast_release",
      "payload": {
        "spell": "arc_burst"
      }
    }
  ]
}