{
  "$schema": "../../../shared/schemas/anim_clip.schema.json",
  "version": "1.0.0",
  "id": "44444444-dddd-4e5f-b067-000000000004",
  "name": "Run",
  "skeletonId": "11111111-aaaa-4b3c-8d2e-000000000001",
  "durationSeconds": 0.7,
  "fps": 30.0,
  "loopable": true,
  "rootMotion": true,
  "channels": [
    {
      "boneIndex": 0,
      "boneName": "root",
      "keyframes": [
        {
          "time": 0.0,
          "translation": [
            0.0,
            0.0,
            0.0
          ],
          "rotation": [
            0.0,
            0.0,
            0.0,
            1.0
          ],
          "scale": [
            1.0,
            1.0,
            1.0
          ]
        },
        {
          "time": 0.175,
          "translation": [
            0.0,
            0.07,
            0.0
          ],
          "rotation": [
            0.0,
            0.0,
            0.0,
            1.0
          ],
          "scale": [
            1.0,
            1.0,
            1.0
          ]
        },
        {
          "time": 0.35,
          "translation": [
            0.0,
            0.0,
            0.0
          ],
          "rotation": [
            0.0,
            0.0,
            0.0,
            1.0
          ],
          "scale": [
            1.0,
            1.0,
            1.0
          ]
        },
        {
          "time": 0.525,
          "translation": [
            0.0,
            0.07,
            0.0
          ],
          "rotation": [
            0.0,
            0.0,
            0.0,
            1.0
          ],
          "scale": [
            1.0,
            1.0,
            1.0
          ]
        },
        {
          "time": 0.7,
          "translation": [
            0.0,
            0.0,
            0.0
          ],
          "rotation": [
            0.0,
            0.0,
            0.0,
            1.0
          ],
          "scale": [
            1.0,
            1.0,
            1.0
          ]
        }
      ]
    },
    {
      "boneIndex": 15,
      "boneName": "L_upper_leg",
      "keyframes": [
        {
          "time": 0.0,
          "translation": [
            0.1,
            -0.04,
            0.0
          ],
          "rotation": [
            0.35,
            0.0,
            0.0,
            0.937
          ],
          "scale": [
            1.0,
            1.0,
            1.0
          ]
        },
        {
          "time": 0.175,
          "translation": [
            0.1,
            -0.04,
            0.0
          ],
          "rotation": [
            0.0,
            0.0,
            0.0,
            1.0
          ],
          "scale": [
            1.0,
            1.0,
            1.0
          ]
        },
        {
          "time": 0.35,
          "translation": [
            0.1,
            -0.04,
            0.0
          ],
          "rotation": [
            -0.3,
            0.0,
            0.0,
            0.954
          ],
          "scale": [
            1.0,
            1.0,
            1.0
          ]
        },
        {
          "time": 0.525,
          "translation": [
            0.1,
            -0.04,
            0.0
          ],
          "rotation": [
            0.0,
            0.0,
            0.0,
            1.0
          ],
          "scale": [
            1.0,
            1.0,
            1.0
          ]
        },
        {
          "time": 0.7,
          "translation": [
            0.1,
            -0.04,
            0.0
          ],
          "rotation": [
            0.35,
            0.0,
            0.0,
            0.937
          ],
          "scale": [
            1.0,
            1.0,
            1.0
          ]
        }
      ]
    },
    {
      "boneIndex": 18,
      "boneName": "R_upper_leg",
      "keyframes": [
        {
          "time": 0.0,
          "translation": [
            -0.1,
            -0.04,
            0.0
          ],
          "rotation": [
            -0.3,
            0.0,
            0.0,
            0.954
          ],
          "scale": [
            1.0,
            1.0,
            1.0
          ]
        },
        {
          "time": 0.175,
          "translation": [
            -0.1,
            -0.04,
            0.0
          ],
          "rotation": [
            0.0,
            0.0,
            0.0,
            1.0
          ],
          "scale": [
            1.0,
            1.0,
            1.0
          ]
        },
        {
          "time": 0.35,
          "translation": [
            -0.1,
            -0.04,
            0.0
          ],
          "rotation": [
            0.35,
            0.0,
            0.0,
            0.937
          ],
          "scale": [
            1.0,
            1.0,
            1.0
          ]
        },
        {
          "time": 0.525,
          "translation": [
            -0.1,
            -0.04,
            0.0
          ],
          "rotation": [
            0.0,
            0.0,
            0.0,
            1.0
          ],
          "scale": [
            1.0,
            1.0,
            1.0
          ]
        },
        {
          "time": 0.7,
          "translation": [
            -0.1,
            -0.04,
            0.0
          ],
          "rotation": [
            -0.3,
            0.0,
            0.0,
            0.954
          ],
          "scale": [
            1.0,
            1.0,
            1.0
          ]
        }
      ]
    },
    {
      "boneIndex": 8,
      "boneName": "L_upper_arm",
      "keyframes": [
        {
          "time": 0.0,
          "translation": [
            0.22,
            0.0,
            0.0
          ],
          "rotation": [
            -0.25,
            0.0,
            0.0,
            0.968
          ],
          "scale": [
            1.0,
            1.0,
            1.0
          ]
        },
        {
          "time": 0.35,
          "translation": [
            0.22,
            0.0,
            0.0
          ],
          "rotation": [
            0.25,
            0.0,
            0.0,
            0.968
          ],
          "scale": [
            1.0,
            1.0,
            1.0
          ]
        },
        {
          "time": 0.7,
          "translation": [
            0.22,
            0.0,
            0.0
          ],
          "rotation": [
            -0.25,
            0.0,
            0.0,
            0.968
          ],
          "scale": [
            1.0,
            1.0,
            1.0
          ]
        }
      ]
    },
    {
      "boneIndex": 12,
      "boneName": "R_upper_arm",
      "keyframes": [
        {
          "time": 0.0,
          "translation": [
            -0.22,
            0.0,
            0.0
          ],
          "rotation": [
            0.25,
            0.0,
            0.0,
            0.968
          ],
          "scale": [
            1.0,
            1.0,
            1.0
          ]
        },
        {
          "time": 0.35,
          "translation": [
            -0.22,
            0.0,
            0.0
          ],
          "rotation": [
            -0.25,
            0.0,
            0.0,
            0.968
          ],
          "scale": [
            1.0,
            1.0,
            1.0
          ]
        },
        {
          "time": 0.7,
          "translation": [
            -0.22,
            0.0,
            0.0
          ],
          "rotation": [
            0.25,
            0.0,
            0.0,
            0.968
          ],
          "scale": [
            1.0,
            1.0,
            1.0
          ]
        }
      ]
    }
  ]
}